{
  "schema_id": "gait.voice.say_token",
  "schema_version": "1.0.0",
  "created_at": "2026-02-15T00:00:00Z",
  "producer_version": "0.0.0-test",
  "token_id": "token_demo",
  "commitment_class": "refund",
  "intent_digest": "3333333333333333333333333333333333333333333333333333333333333333",
  "policy_digest": "4444444444444444444444444444444444444444444444444444444444444444",
  "call_id": "call_demo",
  "turn_index": 3,
  "call_seq": 8,
  "currency": "USD",
  "refund_ceiling_cents": 5000,
  "expires_at": "2026-02-15T01:00:00Z",
  "signature": {
    "alg": "ed25519",
    "key_id": "key_demo",
    "sig": "ZmFrZV9zaWduYXR1cmU="
  }
}
